{
  "$schema": "https://json-schema.org/draft/2020-12/schema",
  "$id": "https://schemas.ecp-protocol.org/0.7.0/registration-amendment.schema.json",
  "title": "ECP Registration Amendment (M3-RG0 — new version/event, never a rewrite)",
  "description": "An amendment event against an accepted trust-registration record (M3-RG0, 0.7.0, order §5). Amendments NEVER mutate the original record: the original file stays byte-identical and its commitments remain verifiable; the amendment is a new append-only document plus a lineage amendment-recorded event. Case content and ground truth are NOT amendable — the only correction path for those is explicit invalidation. Permissible amendment kinds: environment-revision (new environment commitment), provenance-correction (new provenance commitment), invalidation (explicit, motivated retirement of the registration). target_registration_hash binds the amendment to the EXACT original version it amends. amendment_hash = SHA-256 over the ECP-CANONICAL-JSON-1.0 serialization with amendment_hash removed. Real amendment material lives only in a private trust area; public illustrations under examples/ must be format-illustration records with real recomputable hashes.",
  "type": "object",
  "required": [
    "ecp_object",
    "amendment_id",
    "target_registration_id",
    "target_registration_hash",
    "amendment_kind",
    "motivation",
    "lineage",
    "recorded_at",
    "protocol_version",
    "schema_version",
    "amendment_hash"
  ],
  "properties": {
    "ecp_object": { "const": "registration-amendment" },
    "content_class": {
      "enum": ["review", "format-illustration"],
      "description": "'review' = real amendment material (private trust area only); 'format-illustration' = public dummy (examples/ only)."
    },
    "amendment_id": {
      "type": "string",
      "pattern": "^ECP-TAMND-[0-9]{6}$",
      "description": "Deterministic identity assigned by the Registration Authority (monotone)."
    },
    "target_registration_id": {
      "type": "string",
      "pattern": "^ECP-TREG-[0-9]{6}$"
    },
    "target_registration_hash": {
      "$ref": "#/$defs/sha256_hex",
      "description": "SHA-256 over the FULL target record (including its populated registration_hash) — binds this amendment to one exact original version."
    },
    "amendment_kind": {
      "enum": ["environment-revision", "provenance-correction", "invalidation"]
    },
    "motivation": {
      "type": "string",
      "minLength": 1,
      "description": "Explicit, non-empty motivation — silent corrections are forbidden."
    },
    "replacement": {
      "type": "object",
      "minProperties": 1,
      "additionalProperties": false,
      "properties": {
        "environment": {
          "type": "object",
          "required": ["environment_id"],
          "description": "The revised environment document (new environment commitment recomputed by the authority)."
        },
        "provenance": {
          "type": "object",
          "required": ["origin"],
          "description": "The corrected provenance document (new provenance commitment recomputed by the authority)."
        }
      },
      "description": "New-version content for the amended field. Case content and ground truth are never replaceable here (invalidation is the only path)."
    },
    "new_commitments": {
      "type": "object",
      "additionalProperties": false,
      "properties": {
        "environment": { "$ref": "#/$defs/sha256_hex" },
        "provenance": { "$ref": "#/$defs/sha256_hex" }
      },
      "description": "Commitments recomputed by the authority over the replacement documents (recorded in the amendment event for verification)."
    },
    "lineage": {
      "type": "object",
      "required": ["event_index"],
      "additionalProperties": false,
      "properties": {
        "event_index": {
          "type": "integer",
          "minimum": 1,
          "description": "Index of the amendment-recorded lineage event (the event carries this amendment's amendment_hash)."
        }
      }
    },
    "recorded_at": { "$ref": "#/$defs/iso8601_utc" },
    "protocol_version": { "$ref": "#/$defs/semver" },
    "schema_version": { "$ref": "#/$defs/semver" },
    "amendment_hash": { "$ref": "#/$defs/sha256_hex" }
  },
  "additionalProperties": false,
  "allOf": [
    {
      "if": {
        "properties": { "amendment_kind": { "not": { "const": "invalidation" } } }
      },
      "then": { "required": ["replacement"] }
    }
  ],
  "$defs": {
    "semver": {
      "type": "string",
      "pattern": "^(0|[1-9]\\d*)\\.(0|[1-9]\\d*)\\.(0|[1-9]\\d*)(?:-((?:0|[1-9]\\d*|\\d*[a-zA-Z-][0-9a-zA-Z-]*)(?:\\.(?:0|[1-9]\\d*|\\d*[a-zA-Z-][0-9a-zA-Z-]*))*))?(?:\\+([0-9a-zA-Z-]+(?:\\.[0-9a-zA-Z-]+)*))?$"
    },
    "sha256_hex": { "type": "string", "pattern": "^[0-9a-f]{64}$" },
    "iso8601_utc": {
      "type": "string",
      "pattern": "^\\d{4}-\\d{2}-\\d{2}T\\d{2}:\\d{2}:\\d{2}(\\.\\d+)?Z$"
    }
  }
}
